<?xml version="1.0" encoding="UTF-8"?>

<root xmlns:xsi="http://www.w3.org/2001/XMLSchema-instance"
xsi:noNamespaceSchemaLocation="person.xsd">
    <person>
        <name>
            <FirstName>Aashish</FirstName>
            <LastName>Sharma</LastName>
        </name>
        <age>20</age>
        <address>Earth</address>
        <phone>call me maybe</phone>
    </person>

    <person>
        <name>
            <FirstName>Sanskrita</FirstName>
            <LastName>Saha</LastName>
        </name>
        <age>20</age>
        <address>Earth</address>
        <phone>call me maybe</phone>
    </person>
</root>